<?xml version="1.0" encoding="UTF-8"?>
<xs:schema xmlns="http://www.ingenico.com/C3ConfigXMLSchema" xmlns:xs="http://www.w3.org/2001/XMLSchema" targetNamespace="http://www.ingenico.com/C3ConfigXMLSchema">
	<xs:element name="field">
		<xs:complexType>
			<xs:attribute name="name" use="required">
				<xs:simpleType>
					<xs:restriction base="xs:string"/>
				</xs:simpleType>
			</xs:attribute>
			<xs:attribute name="print" use="required">
				<xs:simpleType>
					<xs:restriction base="xs:string">
						<xs:enumeration value="YES"/>
						<xs:enumeration value="NO"/>
					</xs:restriction>
				</xs:simpleType>
			</xs:attribute>
			<xs:attribute name="position" use="required">
				<xs:simpleType>
					<xs:restriction base="xs:string">
						<xs:enumeration value="RIGHT"/>
						<xs:enumeration value="CENTER"/>
						<xs:enumeration value="LEFT"/>
						<xs:enumeration value="JUSTIFIED"/>
					</xs:restriction>
				</xs:simpleType>
			</xs:attribute>
			<xs:attribute name="wordwrap" use="optional">
				<xs:simpleType>
					<xs:restriction base="xs:string">
						<xs:enumeration value="NO"/>
						<xs:enumeration value="YES"/>
					</xs:restriction>
				</xs:simpleType>
			</xs:attribute>
			<xs:attribute name="emptyline" use="optional" default="0">
				<xs:simpleType>
					<xs:restriction base="xs:int">
						<xs:minInclusive value="0"/>
						<xs:maxInclusive value="9"/>
					</xs:restriction>
				</xs:simpleType>
			</xs:attribute>
			<xs:attribute name="mode" use="optional">
				<xs:simpleType>
					<xs:restriction base="xs:string"/>
				</xs:simpleType>
			</xs:attribute>
		</xs:complexType>
	</xs:element>
	<xs:element name="config">
		<xs:complexType>
			<xs:sequence>
				<xs:element ref="application" minOccurs="0" maxOccurs="unbounded"/>
			</xs:sequence>
		</xs:complexType>
	</xs:element>
	<xs:element name="receipt">
		<xs:complexType>
			<xs:sequence>
				<xs:element ref="field" minOccurs="0" maxOccurs="unbounded"/>
			</xs:sequence>
			<xs:attribute name="name" use="required">
				<xs:simpleType>
					<xs:restriction base="xs:string">
						<xs:enumeration value="CLIENT"/>
						<xs:enumeration value="DETAILS"/>
						<xs:enumeration value="MERCHANT"/>
						<xs:enumeration value="DUPLICATE"/>
					</xs:restriction>
				</xs:simpleType>
			</xs:attribute>
		</xs:complexType>
	</xs:element>
	<xs:element name="application">
		<xs:complexType>
			<xs:sequence>
				<xs:element ref="receipt" maxOccurs="unbounded"/>
			</xs:sequence>
			<xs:attribute name="name" use="required">
				<xs:simpleType>
					<xs:restriction base="xs:string">
						<xs:enumeration value="AGC"/>
						<xs:enumeration value="CCP"/>
						<xs:enumeration value="CLS"/>
						<xs:enumeration value="EHL"/>
						<xs:enumeration value="DCI"/>
					</xs:restriction>
				</xs:simpleType>
			</xs:attribute>
		</xs:complexType>
	</xs:element>
</xs:schema>
